{
  "CARD_ID": "BRUTUS-CARD-QUEEN-CLOCK-0001",
  "VERSION": "0.1",
  "ANCHOR": "ANCHOR-0001",
  "SOURCE": "ASTRA_STATION",
  "TARGET": "QUEEN_CLOCK",
  "VERSO": "DEFAULT_LOCKED",
  "READ": [
    "queen.clock"
  ],
  "MEASURE": [
    "identity_continuity",
    "freshness_status",
    "integrity_match"
  ],
  "RETURN_DATA": [
    "entity_id",
    "tick",
    "generation",
    "queen_mode",
    "reference_h256",
    "status",
    "condition"
  ],
  "WRITE": false,
  "CODE_CHANGE": false,
  "CREATE_ROUTE": false,
  "VALUES": {},
  "EXPECTED_OUTPUT": "Fresh integrity-verified Queen clock observation",
  "PROOF_REQUIRED": true,
  "AFTER": "DEFAULT_LOCKED"
}
